<?xml version="1.0" encoding="UTF-8"?>
<!--
Licensed to the Apache Software Foundation (ASF) under one
or more contributor license agreements.  See the NOTICE file
distributed with this work for additional information
regarding copyright ownership.  The ASF licenses this file
to you under the Apache License, Version 2.0 (the
"License"); you may not use this file except in compliance
with the License.  You may obtain a copy of the License at

http://www.apache.org/licenses/LICENSE-2.0

Unless required by applicable law or agreed to in writing,
software distributed under the License is distributed on an
"AS IS" BASIS, WITHOUT WARRANTIES OR CONDITIONS OF ANY
KIND, either express or implied.  See the License for the
specific language governing permissions and limitations
under the License.
-->
<site-conf xmlns:xsi="http://www.w3.org/2001/XMLSchema-instance"
        xsi:noNamespaceSchemaLocation="http://ofbiz.apache.org/dtds/site-conf.xsd">
    <include location="component://common/webcommon/WEB-INF/common-controller.xml"/>
    <include location="component://accounting/webapp/accounting/WEB-INF/controller.xml"/>
    <description>Accounting Manager Module Site Configuration File</description>
    <owner>Copyright 2001-2008 The Apache Software Foundation</owner>

    <!-- Request Mappings -->
    <request-map uri="main">
        <security https="true" auth="true"/>
        <response name="success" type="view" value="main"/>
    </request-map>
    <request-map uri="ListReports">
        <security https="true" auth="true"/>
        <response name="success" type="view" value="ListReports"/>
    </request-map>

    <!-- end of request mappings -->

    <!-- View Mappings -->
    <view-map name="main" type="screen" page="component://accounting/widget/ar/CommonScreens.xml#main"/>
    <view-map name="ListReports" type="screen" page="component://accounting/widget/ar/InvoiceScreens.xml#ListReports"/>
    <!-- end of view mappings -->
</site-conf>