<?xml version="1.0" encoding="UTF-8"?>
<!--
Licensed to the Apache Software Foundation (ASF) under one
or more contributor license agreements.  See the NOTICE file
distributed with this work for additional information
regarding copyright ownership.  The ASF licenses this file
to you under the Apache License, Version 2.0 (the
"License"); you may not use this file except in compliance
with the License.  You may obtain a copy of the License at

http://www.apache.org/licenses/LICENSE-2.0

Unless required by applicable law or agreed to in writing,
software distributed under the License is distributed on an
"AS IS" BASIS, WITHOUT WARRANTIES OR CONDITIONS OF ANY
KIND, either express or implied.  See the License for the
specific language governing permissions and limitations
under the License.
-->

<site-conf xmlns:xsi="http://www.w3.org/2001/XMLSchema-instance"
        xsi:noNamespaceSchemaLocation="http://ofbiz.apache.org/dtds/site-conf.xsd">
    <description>Portal ControlServlet Configuration File</description>
    <owner>Copyright 2001-2008 The Apache Software Foundation</owner>

    <!-- Portal requests -->
    <request-map uri="showPortalPage">
        <security https="true" auth="true"/>
        <response name="success" type="view" value="showPortalPage" save-home-view="true"/>
    </request-map>
    <request-map uri="ManagePortalPages">
        <security https="true" auth="true"/>
        <event  type="simple" invoke="copyIfRequiredSystemPage" path="component://common/script/org/ofbiz/common/PortalPageMethods.xml"/>
        <response name="success" type="view" value="ManagePortalPages"/>
    </request-map>
    <request-map uri="AddPortlet">
        <security https="true" auth="true"/>
        <response name="success" type="view" value="AddPortlet"/>
    </request-map>
    <request-map uri="createPortalPagePortlet">
        <security https="true" auth="true"/>
        <event type="service" invoke="createPortalPagePortlet"/>
        <response name="success" type="request" value="ManagePortalPages"/>
        <response name="error" type="request" value="ManagePortalPages"/>
    </request-map>
    <request-map uri="updatePortalPagePortlet">
        <security https="true" auth="true"/>
        <event type="service" invoke="updatePortalPagePortlet"/>
        <response name="success" type="request" value="ManagePortalPages"/>
        <response name="error" type="request" value="ManagePortalPages"/>
    </request-map>
    <request-map uri="updatePortalPagePortletSeq">
        <security https="true" auth="true"/>
        <event type="service" invoke="updatePortalPagePortletSeq"/>
        <response name="success" type="request" value="ManagePortalPages"/>
        <response name="error" type="request" value="ManagePortalPages"/>
    </request-map>
    <request-map uri="deletePortalPagePortlet">
        <security https="true" auth="true"/>
        <event type="service" invoke="deletePortalPagePortlet"/>
        <response name="success" type="request" value="ManagePortalPages"/>
        <response name="error" type="request" value="ManagePortalPages"/>
    </request-map>
    <request-map uri="movePortletToPortalPage">
        <security https="true" auth="true"/>
        <event type="service" invoke="movePortletToPortalPage"/>
        <response name="success" type="request" value="ManagePortalPages"/>
        <response name="error" type="request" value="ManagePortalPages"/>
    </request-map>
    <request-map uri="createPortalPage">
        <security https="true" auth="true"/>
        <event type="service" invoke="createPortalPage"/>
        <response name="success" type="request" value="ManagePortalPages"/>
        <response name="error" type="request" value="ManagePortalPages"/>
    </request-map>
    <request-map uri="updatePortalPage">
        <security https="true" auth="true"/>
        <event type="service" invoke="updatePortalPage"/>
        <response name="success" type="request" value="ManagePortalPages"/>
        <response name="error" type="request" value="ManagePortalPages"/>
    </request-map>
    <request-map uri="deletePortalPage">
        <security https="true" auth="true"/>
        <event type="service" invoke="deletePortalPage"/>
        <response name="success" type="request" value="ManagePortalPages"/>
        <response name="error" type="request" value="ManagePortalPages"/>
    </request-map>
    <request-map uri="setPortalPortletAttributes">
        <security https="true" auth="true"/>
        <event type="simple" invoke="setPortalPortletAttributes" path="component://common/script/org/ofbiz/common/PortalPageMethods.xml"/>
        <response name="success" type="request" value="ManagePortalPages"/>
        <response name="error" type="request" value="ManagePortalPages"/>
    </request-map>
    <request-map uri="addPortalPageColumn">
        <security https="true" auth="true"/>
        <event type="service" invoke="addPortalPageColumn"/>
        <response name="success" type="request" value="ManagePortalPages"/>
        <response name="error" type="request" value="ManagePortalPages"/>
    </request-map>
    <request-map uri="updatePortalPageColumn">
        <security https="true" auth="true"/>
        <event type="service" invoke="updatePortalPageColumn"/>
        <response name="success" type="request" value="ManagePortalPages"/>
        <response name="error" type="request" value="ManagePortalPages"/>
    </request-map>
    <request-map uri="deletePortalPageColumn">
        <security https="true" auth="true"/>
        <event type="service" invoke="deletePortalPageColumn"/>
        <response name="success" type="request" value="ManagePortalPages"/>
        <response name="error" type="request" value="ManagePortalPages"/>
    </request-map>
    <request-map uri="updatePortalPageSeq">
        <security https="true" auth="true"/>
        <event type="service" invoke="updatePortalPageSeq"/>
        <response name="success" type="request" value="ManagePortalPages"/>
        <response name="error" type="request" value="ManagePortalPages"/>
    </request-map>

    <!-- View Mappings -->
    <view-map name="showPortalPage" type="screen" page="component://common/widget/PortalPageScreens.xml#showPortalPage"/>
    <view-map name="ManagePortalPages" type="screen" page="component://common/widget/PortalPageScreens.xml#ManagePortalPages"/>
    <view-map name="AddPortlet" type="screen" page="component://common/widget/PortalPageScreens.xml#AddPortlet"/>
</site-conf>
